movie_id,original_title,genres,synopsis,cover_url,orig_genre
103874,Dracula,"['Drama', 'Fantasy', 'Horror', 'Romance']",The centuries old vampire Count Dracula comes to England to seduce his barrister Jonathan Harker's fiancée Mina Murray and inflict havoc in the foreign land.,https://m.media-amazon.com/images/M/MV5BNjcyMDZlMTktYTIxOC00ZWFhLWJkYzgtNWNiYjAwYTFkNjIyXkEyXkFqcGdeQXVyNTIzOTk5ODM@.jpg,Drama
8178634,RRR (Rise Roar Revolt),"['Action', 'Drama']",A fictitious story about two legendary revolutionaries and their journey away from home before they started fighting for their country in the 1920s.,https://m.media-amazon.com/images/M/MV5BODUwNDNjYzctODUxNy00ZTA2LWIyYTEtMDc5Y2E5ZjBmNTMzXkEyXkFqcGdeQXVyODE5NzE3OTE@.jpg,Drama
10354106,Stars at Noon,"['Drama', 'Romance', 'Thriller']","A young American journalist stranded in present-day Nicaragua falls for an enigmatic Englishman who seems like her best chance of escape. She soon realizes, that he may be in even greater danger than she is.",https://m.media-amazon.com/images/M/MV5BMGNkOTI5OTgtZGM0Yi00ZmExLTgzMzctMDkxMDk4MjE4ZTZmXkEyXkFqcGdeQXVyMTAzMDg4NzU0.jpg,Drama
14114802,The Outfit,"['Crime', 'Drama', 'Mystery', 'Thriller']",An expert cutter must outwit a dangerous group of mobsters in order to survive a fateful night.,https://m.media-amazon.com/images/M/MV5BYWQ0NWUyMjktYjg4Yy00NmY3LTg2YzEtNWY5OTY5YTc2MjhjXkEyXkFqcGdeQXVyMTA2MDU0NjM5.jpg,Drama
7657566,Death on the Nile,"['Crime', 'Drama', 'Mystery']","While on vacation on the Nile, Hercule Poirot must investigate the murder of a young heiress.",https://m.media-amazon.com/images/M/MV5BNjI4ZTQ1OTYtNTI0Yi00M2EyLThiNjMtMzk1MmZlOWMyMDQwXkEyXkFqcGdeQXVyMTEyMjM2NDc2.jpg,Drama
3605418,Knock Knock,"['Drama', 'Thriller']","A devoted father helps two stranded young women who knock on his door, but his kind gesture turns into a dangerous seduction and a deadly game of cat and mouse.",https://m.media-amazon.com/images/M/MV5BYTQ3MzhlZjQtNWMxOS00NTEzLTgzOWYtNTI3MjhmZGU0ZDM2XkEyXkFqcGdeQXVyMTQxNzMzNDI@.jpg,Drama
109830,Forrest Gump,"['Drama', 'Romance']","The presidencies of Kennedy and Johnson, the Vietnam War, the Watergate scandal and other historical events unfold from the perspective of an Alabama man with an IQ of 75, whose only desire is to be reunited with his childhood sweetheart.",https://m.media-amazon.com/images/M/MV5BNWIwODRlZTUtY2U3ZS00Yzg1LWJhNzYtMmZiYmEyNmU1NjMzXkEyXkFqcGdeQXVyMTQxNzMzNDI@.jpg,Drama
14438964,Goodbye,"['Comedy', 'Drama', 'Family']",A heartwarming story of the Bhalla family that depicts their journey of grief and self-discovery after they suffer the loss of their loved one.,https://m.media-amazon.com/images/M/MV5BNGNjMWIyMTMtMGU3Yi00MmJmLWE5MzMtZGM5YzlhM2JlYWI3XkEyXkFqcGdeQXVyODE5NzE3OTE@.jpg,Drama
36855,Gaslight,"['Crime', 'Drama', 'Mystery', 'Romance', 'Thriller']","Ten years after her aunt was murdered in their London home, a woman returns from Italy in the 1880s to resume residence with her new husband. His obsessive interest in the home rises from a secret that may require driving his wife insane.",https://m.media-amazon.com/images/M/MV5BNTU0Y2YyZTgtZWQ4ZC00YTNkLTgxMTktYTE3OTQ0Y2FjNTM2XkEyXkFqcGdeQXVyNzYxODE3NTQ@.jpg,Drama
9853500,Bandit,"['Crime', 'Drama', 'Thriller']","After escaping a Michigan prison, a charming career criminal assumes a new identity in Canada and goes on to rob a record 59 banks and jewellery stores while being hunted by a police task force. Based on the story of The Flying Bandit.",https://m.media-amazon.com/images/M/MV5BYmIzMTdjYzgtYmIzZS00YTc0LWFmODktMmQ4ZTAwZWVmYzcwXkEyXkFqcGdeQXVyODk5NjQ4NjE@.jpg,Drama
2935622,The School for Good and Evil,"['Action', 'Comedy', 'Drama', 'Fantasy']",Best friends Sophie and Agatha find themselves on opposing sides of an epic battle when they're swept away into an enchanted school where aspiring heroes and villains are trained to protect the balance between Good and Evil.,https://m.media-amazon.com/images/M/MV5BNzM1ODI4Y2UtMGYxMS00OTUxLWE4NzItNjgxMTM2NzRjZThkXkEyXkFqcGdeQXVyMTA1OTcyNDQ4.jpg,Drama
8550054,Pleasure,['Drama'],"Bella Cherry arrives in Los Angeles with dreams of becoming an adult film star, but she soon learns that fame won't come easy as she harnesses her ambition and cunning to rise to the top of this mesmerizing and singular world.",https://m.media-amazon.com/images/M/MV5BNmU3ZTJjMTEtYzc2Ny00YjVhLTkyYmQtZTFhYWY0N2MxMzkxXkEyXkFqcGdeQXVyMTM1MTE1NDMx.jpg,Drama
120791,Practical Magic,"['Comedy', 'Drama', 'Fantasy', 'Romance']","Two witch sisters, raised by their eccentric aunts in a small town, face closed-minded prejudice and a curse which threatens to prevent them ever finding lasting love.",https://m.media-amazon.com/images/M/MV5BMzU4MmNkNGYtN2I1Zi00ZDEzLTlmZjItNWQ5NWI0NzcwZDQxXkEyXkFqcGdeQXVyMTQxNzMzNDI@.jpg,Drama
5500218,Samaritan,"['Action', 'Drama', 'Fantasy', 'Sci-Fi']",A young boy learns that a superhero who was thought to have gone missing after an epic battle twenty years ago may in fact still be around.,https://m.media-amazon.com/images/M/MV5BY2M2MjMxNjUtZWU2MS00NTIwLWE0ZDEtOTY3NzY5NGZmY2RmXkEyXkFqcGdeQXVyODk2NDQ3MTA@.jpg,Drama
120338,Titanic,"['Drama', 'Romance']","A seventeen-year-old aristocrat falls in love with a kind but poor artist aboard the luxurious, ill-fated R.M.S. Titanic.",https://m.media-amazon.com/images/M/MV5BMDdmZGU3NDQtY2E5My00ZTliLWIzOTUtMTY4ZGI1YjdiNjk3XkEyXkFqcGdeQXVyNTA4NzY1MzY@.jpg,Drama
5537002,Killers of the Flower Moon,"['Crime', 'Drama', 'History', 'Mystery', 'Thriller', 'Western']",Members of the Osage tribe in the United States are murdered under mysterious circumstances in the 1920s sparking a major F.B.I. investigation involving J. Edgar Hoover.,https://m.media-amazon.com/images/M/MV5BZmMyMDc4NWMtZmUzNC00ZjczLWE1ZmYtYWQ3ZTk4ODBmYzE2XkEyXkFqcGdeQXVyMTkxNjUyNQ@@.jpg,Drama
780536,In Bruges,"['Comedy', 'Crime', 'Drama', 'Thriller']","Guilt-stricken after a job gone wrong, hitman Ray and his partner await orders from their ruthless boss in Bruges, Belgium, the last place in the world Ray wants to be.",https://m.media-amazon.com/images/M/MV5BMTUwOGFiM2QtOWMxYS00MjU2LThmZDMtZDM2MWMzNzllNjdhXkEyXkFqcGdeQXVyMTMxODk2OTU@.jpg,Drama
10640346,Babylon,"['Comedy', 'Drama', 'History']","A tale of outsized ambition and outrageous excess, it traces the rise and fall of multiple characters during an era of unbridled decadence and depravity in early Hollywood.",https://m.media-amazon.com/images/M/MV5BZmM4MWIwMGItYzA3ZC00MDY4LTlhNWQtY2MwOTViODk1M2U1XkEyXkFqcGdeQXVyMDM2NDM2MQ@@.jpg,Drama
14641788,Enola Holmes 2,"['Action', 'Adventure', 'Crime', 'Drama', 'Mystery']","Now a detective-for-hire, Enola Holmes takes on her first official case to find a missing girl as the sparks of a dangerous conspiracy ignite a mystery that requires the help of friends - and Sherlock himself - to unravel",https://m.media-amazon.com/images/M/MV5BMDI1NWM1ZDItNDFhMi00YWRhLTg1YzItNTNhY2M2N2QzY2FkXkEyXkFqcGdeQXVyMTEyMjM2NDc2.jpg,Drama
2582802,Whiplash,"['Drama', 'Music']",A promising young drummer enrolls at a cut-throat music conservatory where his dreams of greatness are mentored by an instructor who will stop at nothing to realize a student's potential.,https://m.media-amazon.com/images/M/MV5BOTA5NDZlZGUtMjAxOS00YTRkLTkwYmMtYWQ0NWEwZDZiNjEzXkEyXkFqcGdeQXVyMTMxODk2OTU@.jpg,Drama
11252248,Dog,"['Comedy', 'Drama']",Two former Army Rangers are paired against their will on the road trip of a lifetime. Briggs (Channing Tatum) and Lulu (a Belgian Malinois) race down the Pacific Coast to get to a fellow soldier's funeral on time.,https://m.media-amazon.com/images/M/MV5BYjE0ZDZmYmUtOWQyMy00NmNkLWExOTgtOWRmOTkxNjc0NTEzXkEyXkFqcGdeQXVyMjAwNzczNTU@.jpg,Drama
1856101,Blade Runner 2049,"['Action', 'Drama', 'Mystery', 'Sci-Fi', 'Thriller']","Young Blade Runner K's discovery of a long-buried secret leads him to track down former Blade Runner Rick Deckard, who's been missing for thirty years.",https://m.media-amazon.com/images/M/MV5BNzA1Njg4NzYxOV5BMl5BanBnXkFtZTgwODk5NjU3MzI@.jpg,Drama
6751668,Gisaengchung,"['Drama', 'Thriller']",Greed and class discrimination threaten the newly formed symbiotic relationship between the wealthy Park family and the destitute Kim clan.,https://m.media-amazon.com/images/M/MV5BYWZjMjk3ZTItODQ2ZC00NTY5LWE0ZDYtZTI3MjcwN2Q5NTVkXkEyXkFqcGdeQXVyODk4OTc3MTY@.jpg,Drama
9639470,Last Night in Soho,"['Drama', 'Horror', 'Mystery', 'Thriller']","An aspiring fashion designer is mysteriously able to enter the 1960s, where she encounters a dazzling wannabe singer. But the glamour is not all it appears to be and the dreams of the past start to crack and splinter into something darker.",https://m.media-amazon.com/images/M/MV5BZjgwZDIwY2MtNGZlNy00NGRlLWFmNTgtOTBkZThjMDUwMGJhXkEyXkFqcGdeQXVyMTEyMjM2NDc2.jpg,Drama
73486,One Flew Over the Cuckoo's Nest,['Drama'],"In the Fall of 1963, a Korean War veteran and criminal pleads insanity and is admitted to a mental institution, where he rallies up the scared patients against the tyrannical nurse.",https://m.media-amazon.com/images/M/MV5BZjA0OWVhOTAtYWQxNi00YzNhLWI4ZjYtNjFjZTEyYjJlNDVlL2ltYWdlL2ltYWdlXkEyXkFqcGdeQXVyMTQxNzMzNDI@.jpg,Drama
2322441,Fifty Shades of Grey,"['Drama', 'Romance', 'Thriller']","Literature student Anastasia Steele's life changes forever when she meets handsome, yet tormented, billionaire Christian Grey.",https://m.media-amazon.com/images/M/MV5BMjE1MTM4NDAzOF5BMl5BanBnXkFtZTgwNTMwNjI0MzE@.jpg,Drama
7347846,The Lodge,"['Drama', 'Horror', 'Mystery', 'Thriller']","A soon-to-be stepmom is snowed in with her fiancé's two children at a remote holiday village. Just as relations begin to thaw between the trio, some strange and frightening events take place.",https://m.media-amazon.com/images/M/MV5BNDQ2YWVmZjEtMTE1ZS00MDk1LTg5ODUtMDVlODk0OTM2ODMwXkEyXkFqcGdeQXVyMTkxNjUyNQ@@.jpg,Drama
2267998,Gone Girl,"['Drama', 'Mystery', 'Thriller']","With his wife's disappearance having become the focus of an intense media circus, a man sees the spotlight turned on him when it's suspected that he may not be innocent.",https://m.media-amazon.com/images/M/MV5BMTk0MDQ3MzAzOV5BMl5BanBnXkFtZTgwNzU1NzE3MjE@.jpg,Drama
4273800,The Good Nurse,"['Biography', 'Crime', 'Drama', 'Thriller']",An infamous caregiver is implicated in the deaths of hundreds of hospital patients.,https://m.media-amazon.com/images/M/MV5BOGZhODQ3NDUtMjE1OS00MzEzLWFhY2MtY2U2YjQzYWUyYWQwXkEyXkFqcGdeQXVyMDM2NDM2MQ@@.jpg,Drama
112573,Braveheart,"['Biography', 'Drama', 'History', 'War']",Scottish warrior William Wallace leads his countrymen in a rebellion to free his homeland from the tyranny of King Edward I of England.,https://m.media-amazon.com/images/M/MV5BMzkzMmU0YTYtOWM3My00YzBmLWI0YzctOGYyNTkwMWE5MTJkXkEyXkFqcGdeQXVyNzkwMjQ5NzM@.jpg,Drama
4016934,Ah-ga-ssi,"['Drama', 'Romance', 'Thriller']","A woman is hired as a handmaiden to a Japanese heiress, but secretly she is involved in a plot to defraud her.",https://m.media-amazon.com/images/M/MV5BNDJhYTk2MTctZmVmOS00OTViLTgxNjQtMzQxOTRiMDdmNGRjXkEyXkFqcGdeQXVyMTMxODk2OTU@.jpg,Drama
327597,Coraline,"['Animation', 'Drama', 'Family', 'Fantasy', 'Thriller']","An adventurous 11-year-old girl finds another world that is a strangely idealized version of her frustrating home, but it has sinister secrets.",https://m.media-amazon.com/images/M/MV5BMzQxNjM5NzkxNV5BMl5BanBnXkFtZTcwMzg5NDMwMg@@.jpg,Drama
407887,The Departed,"['Crime', 'Drama', 'Thriller']",An undercover cop and a mole in the police attempt to identify each other while infiltrating an Irish gang in South Boston.,https://m.media-amazon.com/images/M/MV5BMTI1MTY2OTIxNV5BMl5BanBnXkFtZTYwNjQ4NjY3.jpg,Drama
13421498,The Lost King,['Drama'],"An amateur historian defies the stodgy academic establishment in her efforts to find King Richard III's remains, which were lost for over 500 years.",https://m.media-amazon.com/images/M/MV5BOTNiMWE2NWEtYjViMC00ZWI1LWJiMzgtNGU2ZmVkMGNkYTU2XkEyXkFqcGdeQXVyMTk5MTY4Nzg@.jpg,Drama
75314,Taxi Driver,"['Crime', 'Drama']","A mentally unstable veteran works as a nighttime taxi driver in New York City, where the perceived decadence and sleaze fuels his urge for violent action.",https://m.media-amazon.com/images/M/MV5BM2M1MmVhNDgtNmI0YS00ZDNmLTkyNjctNTJiYTQ2N2NmYzc2XkEyXkFqcGdeQXVyNzkwMjQ5NzM@.jpg,Drama
375912,Layer Cake,"['Action', 'Crime', 'Drama', 'Thriller']",A successful cocaine dealer gets two tough assignments from his boss on the eve of his planned early retirement.,https://m.media-amazon.com/images/M/MV5BMTI5MTE1OTAzOV5BMl5BanBnXkFtZTcwNDc2OTgyMQ@@.jpg,Drama
121164,Corpse Bride,"['Animation', 'Drama', 'Family', 'Fantasy', 'Musical', 'Romance']","When a shy groom practices his wedding vows in the inadvertent presence of a deceased young woman, she rises from the grave assuming he has married her.",https://m.media-amazon.com/images/M/MV5BMTk1MTY1NjU4MF5BMl5BanBnXkFtZTcwNjIzMTEzMw@@.jpg,Drama
7349950,It Chapter Two,"['Drama', 'Fantasy', 'Horror']","Twenty-seven years after their first encounter with the terrifying Pennywise, the Losers Club have grown up and moved away, until a devastating phone call brings them back.",https://m.media-amazon.com/images/M/MV5BYTJlNjlkZTktNjEwOS00NzI5LTlkNDAtZmEwZDFmYmM2MjU2XkEyXkFqcGdeQXVyNjg2NjQwMDQ@.jpg,Drama
147800,10 Things I Hate About You,"['Comedy', 'Drama', 'Romance']","A pretty, popular teenager can't go out on a date until her ill-tempered older sister does.",https://m.media-amazon.com/images/M/MV5BMmVhZjhlZDYtMDAwZi00MDcyLTgzOTItOWNiZjY0YmE0MGE0XkEyXkFqcGdeQXVyMTQxNzMzNDI@.jpg,Drama
7888964,Nobody,"['Action', 'Crime', 'Drama', 'Thriller']","A docile family man slowly reveals his true character after his house gets burgled by two petty thieves, which, coincidentally, leads him into a bloody war with a Russian crime boss.",https://m.media-amazon.com/images/M/MV5BMjM5YTRlZmUtZGVmYi00ZjE2LWIyNzAtOWVhMDk1MDdkYzhjXkEyXkFqcGdeQXVyMjMxOTE0ODA@.jpg,Drama
9681686,Chhello Show,['Drama'],"Samay fights heaven and earth to find light. He wants to catch, control, cut and project that light to tell stories. Now to pursue that dream he must leave everything he loves and take a flight to find the light.",https://m.media-amazon.com/images/M/MV5BNGQ1MzY1YTctYWVjNS00YmJjLTlhNDEtN2FjYzFiOGJjYzc2XkEyXkFqcGdeQXVyMTA5NjcyMTU1.jpg,Drama
1853728,Django Unchained,"['Drama', 'Western']","With the help of a German bounty-hunter, a freed slave sets out to rescue his wife from a brutal plantation-owner in Mississippi.",https://m.media-amazon.com/images/M/MV5BMjIyNTQ5NjQ1OV5BMl5BanBnXkFtZTcwODg1MDU4OA@@.jpg,Drama
4614584,Purple Hearts,"['Drama', 'Music', 'Romance']","In spite of their many differences, Cassie, a struggling singer-songwriter, and Luke, a troubled Marine, agree to marry solely for military benefits. But when tragedy strikes, the line between real and pretend begins to blur.",https://m.media-amazon.com/images/M/MV5BNzI4ZTAwNzEtNTk5YS00ZWJmLWI1ODMtOTU4MTM5MzQ4OWM0XkEyXkFqcGdeQXVyMTEzMTI1Mjk3.jpg,Drama
7740496,Nightmare Alley,"['Crime', 'Drama', 'Thriller']",A grifter working his way up from low-ranking carnival worker to lauded psychic medium matches wits with a psychologist bent on exposing him.,https://m.media-amazon.com/images/M/MV5BOTI4NDhhNGEtZjQxZC00ZTRmLThmZTctOGJmY2ZlOTc0ZGY0XkEyXkFqcGdeQXVyMTkxNjUyNQ@@.jpg,Drama
10298810,Lightyear,"['Animation', 'Action', 'Adventure', 'Drama', 'Family', 'Sci-Fi']","While spending years attempting to return home, marooned Space Ranger Buzz Lightyear encounters an army of ruthless robots commanded by Zurg who are attempting to steal his fuel source.",https://m.media-amazon.com/images/M/MV5BYTg2Zjk0ZTctM2ZmMi00MDRmLWJjOGYtNWM0YjBmZTBjMjRkXkEyXkFqcGdeQXVyMTM1MTE1NDMx.jpg,Drama
113277,Heat,"['Action', 'Crime', 'Drama']",A group of high-end professional thieves start to feel the heat from the LAPD when they unknowingly leave a clue at their latest heist.,https://m.media-amazon.com/images/M/MV5BYjZjNTJlZGUtZTE1Ny00ZDc4LTgwYjUtMzk0NDgwYzZjYTk1XkEyXkFqcGdeQXVyNjU0OTQ0OTY@.jpg,Drama
15686024,Togo,"['Crime', 'Drama', 'Thriller']",A car attendant who must defend his territory and the neighbors of the neighborhood against.,https://m.media-amazon.com/images/M/MV5BZTBjMjE2NTEtMWYxOC00ZDc1LTljNmQtYWNkN2IyN2I0MTQ3XkEyXkFqcGdeQXVyMTEyOTc2MjQy.jpg,Drama
180093,Requiem for a Dream,['Drama'],The drug-induced utopias of four Coney Island people are shattered when their addictions run deep.,https://m.media-amazon.com/images/M/MV5BOTdiNzJlOWUtNWMwNS00NmFlLWI0YTEtZmI3YjIzZWUyY2Y3XkEyXkFqcGdeQXVyNjU0OTQ0OTY@.jpg,Drama
167404,The Sixth Sense,"['Drama', 'Mystery', 'Thriller']","A frightened, withdrawn Philadelphia boy who communicates with spirits seeks the help of a disheartened child psychologist.",https://m.media-amazon.com/images/M/MV5BMWM4NTFhYjctNzUyNi00NGMwLTk3NTYtMDIyNTZmMzRlYmQyXkEyXkFqcGdeQXVyMTAwMzUyOTc@.jpg,Drama
13139228,My Policeman,"['Drama', 'Romance']",The arrival of Patrick into Marion and Tom's home triggers the exploration of seismic events from 40 years previously.,https://m.media-amazon.com/images/M/MV5BOTczM2JhOGMtMmQzOC00ZjgwLTlhNDEtMzU3NDRmMTQzMjM4XkEyXkFqcGdeQXVyMDM2NDM2MQ@@.jpg,Drama
1485796,The Greatest Showman,"['Biography', 'Drama', 'Musical']",Celebrates the birth of show business and tells of a visionary who rose from nothing to create a spectacle that became a worldwide sensation.,https://m.media-amazon.com/images/M/MV5BMjI1NDYzNzY2Ml5BMl5BanBnXkFtZTgwODQwODczNTM@.jpg,Drama
119217,Good Will Hunting,"['Drama', 'Romance']","Will Hunting, a janitor at M.I.T., has a gift for mathematics, but needs help from a psychologist to find direction in his life.",https://m.media-amazon.com/images/M/MV5BOTI0MzcxMTYtZDVkMy00NjY1LTgyMTYtZmUxN2M3NmQ2NWJhXkEyXkFqcGdeQXVyMTQxNzMzNDI@.jpg,Drama
2180339,Deep Water,"['Drama', 'Mystery', 'Thriller']",A well-to-do husband who allows his wife to have affairs in order to avoid a divorce becomes a prime suspect in the disappearance of her lovers.,https://m.media-amazon.com/images/M/MV5BNTE1M2NjNDgtYjQ2Ny00YTMzLWJiYWQtMTdmM2Q2YjA1MDg1XkEyXkFqcGdeQXVyODk4OTc3MTY@.jpg,Drama
92005,Stand by Me,"['Adventure', 'Drama']","After the death of one of his friends, a writer recounts a childhood journey with his friends to find the body of a missing boy.",https://m.media-amazon.com/images/M/MV5BODJmY2Y2OGQtMDg2My00N2Q3LWJmZTUtYTc2ODBjZDVlNDlhXkEyXkFqcGdeQXVyMTQxNzMzNDI@.jpg,Drama
71562,The Godfather Part II,"['Crime', 'Drama']","The early life and career of Vito Corleone in 1920s New York City is portrayed, while his son, Michael, expands and tightens his grip on the family crime syndicate.",https://m.media-amazon.com/images/M/MV5BMWMwMGQzZTItY2JlNC00OWZiLWIyMDctNDk2ZDQ2YjRjMWQ0XkEyXkFqcGdeQXVyNzkwMjQ5NzM@.jpg,Drama
289043,28 Days Later...,"['Drama', 'Horror', 'Sci-Fi', 'Thriller']","Four weeks after a mysterious, incurable virus spreads throughout the UK, a handful of survivors try to find sanctuary.",https://m.media-amazon.com/images/M/MV5BYTFkM2ViMmQtZmI5NS00MjQ2LWEyN2EtMTI1ZmNlZDU3MTZjXkEyXkFqcGdeQXVyNjU0OTQ0OTY@.jpg,Drama
120689,The Green Mile,"['Crime', 'Drama', 'Fantasy', 'Mystery']","The lives of guards on Death Row are affected by one of their charges: a black man accused of child murder and rape, yet who has a mysterious gift.",https://m.media-amazon.com/images/M/MV5BMTUxMzQyNjA5MF5BMl5BanBnXkFtZTYwOTU2NTY3.jpg,Drama
12834962,Raksha Bandhan,"['Comedy', 'Drama', 'Family']","Lala Kedarnath, the eldest and only brother of 4 sisters, runs a chaat shop that was started by his father. Lala promises his frail mother on her deathbed that he will get married only after he fulfills the responsibility of marrying his sisters into suitable homes first. What follows is Lala's relentless efforts of getting his sisters married while upholding his family values. At the same time, Lala also faces hiccups on the personal front, his romantic life with his childhood love Sapna. However, Lala's commitment to his sisters stands as a huge roadblock for his and Sapna's love story to take off. Understanding the importance of Lala's vow, Sapna decides to wait till his goal is achieved.",https://m.media-amazon.com/images/M/MV5BNGVhNTQzNDgtZTE3ZS00NmY4LWE0NzktMWI5ODAyOTBjMTk5XkEyXkFqcGdeQXVyMTIyNzY0NTMx.jpg,Drama
3315342,Logan,"['Action', 'Drama', 'Sci-Fi', 'Thriller']","In a future where mutants are nearly extinct, an elderly and weary Logan leads a quiet life. But when Laura, a mutant child pursued by scientists, comes to him for help, he must get her to safety.",https://m.media-amazon.com/images/M/MV5BYzc5MTU4N2EtYTkyMi00NjdhLTg3NWEtMTY4OTEyMzJhZTAzXkEyXkFqcGdeQXVyNjc1NTYyMjg@.jpg,Drama
1099212,Twilight,"['Drama', 'Fantasy', 'Romance']","When Bella Swan moves to a small town in the Pacific Northwest, she falls in love with Edward Cullen, a mysterious classmate who reveals himself to be a 108-year-old vampire.",https://m.media-amazon.com/images/M/MV5BMTQ2NzUxMTAxN15BMl5BanBnXkFtZTcwMzEyMTIwMg@@.jpg,Drama
7466810,777 Charlie,"['Adventure', 'Comedy', 'Drama']",Dharma is stuck in a rut with his negative and lonely lifestyle and spends each day in the comfort of his loneliness. A pup named Charlie enters his life and gives him a new perspective towards it.,https://m.media-amazon.com/images/M/MV5BMDhhMjBlMWYtMDVlMy00ZjM3LTg3MTUtZDg0NjA0YzcxOGY4XkEyXkFqcGdeQXVyMTE0MzY0NjE1.jpg,Drama
8009428,Hustle,"['Comedy', 'Drama', 'Sport']",A basketball scout discovers a phenomenal street ball player while in Spain and sees the prospect as his opportunity to get back into the NBA.,https://m.media-amazon.com/images/M/MV5BYjdhYTE3NjMtZjI3OC00NzVlLWFiNTUtNzQ3NDNiNTI3NDg4XkEyXkFqcGdeQXVyMTEyMjM2NDc2.jpg,Drama
10366460,CODA,"['Comedy', 'Drama', 'Music']","As a CODA (Child of Deaf Adults) Ruby is the only hearing person in her deaf family. When the family's fishing business is threatened, Ruby finds herself torn between pursuing her passion at Berklee College of Music and her fear of abandoning her parents.",https://m.media-amazon.com/images/M/MV5BYzkyNzNiMDItMGU1Yy00NmEyLWE4N2ItMjkzMDZmMmVhNDU4XkEyXkFqcGdeQXVyMTkxNjUyNQ@@.jpg,Drama
1139797,Låt den rätte komma in,"['Drama', 'Fantasy', 'Horror', 'Romance']","Oskar, an overlooked and bullied boy, finds love and revenge through Eli, a beautiful but peculiar girl.",https://m.media-amazon.com/images/M/MV5BOWM4NTY2NTMtZDZlZS00NTgyLWEzZDMtODE3ZGI1MzI3ZmU5XkEyXkFqcGdeQXVyNzI1NzMxNzM@.jpg,Drama
78788,Apocalypse Now,"['Drama', 'Mystery', 'War']",A U.S. Army officer serving in Vietnam is tasked with assassinating a renegade Special Forces Colonel who sees himself as a god.,https://m.media-amazon.com/images/M/MV5BYmQyNTA1ZGItNjZjMi00NzFlLWEzMWEtNWMwN2Q2MjJhYzEyXkEyXkFqcGdeQXVyMjUzOTY1NTc@.jpg,Drama
338013,Eternal Sunshine of the Spotless Mind,"['Drama', 'Romance', 'Sci-Fi']","When their relationship turns sour, a couple undergoes a medical procedure to have each other erased from their memories.",https://m.media-amazon.com/images/M/MV5BMTY4NzcwODg3Nl5BMl5BanBnXkFtZTcwNTEwOTMyMw@@.jpg,Drama
3758542,Ferrari,"['Biography', 'Drama']",The life story of Italian sports car entrepreneur Enzo Ferrari.,https://m.media-amazon.com/images/M/MV5BYjgyNGYzYjAtMzlkZC00NTcyLTk3NjEtYjcxOTU5NThiNTY2XkEyXkFqcGdeQXVyNTkzOTY1MA@@.jpg,Drama
15654262,Chup,"['Drama', 'Romance', 'Thriller']","A psychopath killer, targeting film critics. The film is a fast-paced thriller that raises many questions of the ethics of criticism.",https://m.media-amazon.com/images/M/MV5BNjVhNTdlMWItMzZhYi00MWZmLTk2NDEtYTczNzBhYzM2ZjMyXkEyXkFqcGdeQXVyODE5NzE3OTE@.jpg,Drama
974661,17 Again,"['Comedy', 'Drama', 'Fantasy', 'Romance', 'Sport']",Mike O'Donnell is ungrateful for how his life turned out. He gets a chance to rewrite his life when he tried to save a janitor near a bridge and jumped after him into a time vortex.,https://m.media-amazon.com/images/M/MV5BMjA2NTI1Mzg3N15BMl5BanBnXkFtZTcwMjYwNjAzMg@@.jpg,Drama
86066,The Outsiders,"['Crime', 'Drama']","The rivalry between two gangs, the poor Greasers and the rich Socs, only heats up when one gang member kills a member of the other.",https://m.media-amazon.com/images/M/MV5BY2E4Njk4N2UtZWFhOS00NzczLWFmNDgtMzdhMjFlNTZjMmVhL2ltYWdlL2ltYWdlXkEyXkFqcGdeQXVyMTQxNzMzNDI@.jpg,Drama
86250,Scarface,"['Crime', 'Drama']","In 1980 Miami, a determined Cuban immigrant takes over a drug cartel and succumbs to greed.",https://m.media-amazon.com/images/M/MV5BNjdjNGQ4NDEtNTEwYS00MTgxLTliYzQtYzE2ZDRiZjFhZmNlXkEyXkFqcGdeQXVyNjU0OTQ0OTY@.jpg,Drama
3774694,Love,"['Drama', 'Romance']","Murphy is an American living in Paris who enters a highly sexually and emotionally charged relationship with Electra. Unaware of the effect it will have on their relationship, they invite their pretty neighbor into their bed.",https://m.media-amazon.com/images/M/MV5BZGQxZTFlZDctZjcyMy00NzA1LWFkMDYtNzRmZTkwYTFhYTc3XkEyXkFqcGdeQXVyODE5NzE3OTE@.jpg,Drama
117381,Primal Fear,"['Crime', 'Drama', 'Mystery', 'Thriller']","An altar boy is accused of murdering a priest, and the truth is buried several layers deep.",https://m.media-amazon.com/images/M/MV5BZTM2NWI2OGYtYWNhMi00ZTlmLTg2ZTAtMmI5NWRjODA5YTE1XkEyXkFqcGdeQXVyODE2OTYwNTg@.jpg,Drama
10370710,Verdens verste menneske,"['Comedy', 'Drama', 'Romance']","The chronicles of four years in the life of Julie, a young woman who navigates the troubled waters of her love life and struggles to find her career path, leading her to take a realistic look at who she really is.",https://m.media-amazon.com/images/M/MV5BOGZlODBlMzgtYzdmMC00ZDk0LWI0ZWQtOGJmNTcyNDYzY2EwXkEyXkFqcGdeQXVyMTI3ODAyMzE2.jpg,Drama
8847712,The French Dispatch,"['Comedy', 'Drama', 'Romance']","A love letter to journalists set in an outpost of an American newspaper in a fictional twentieth century French city that brings to life a collection of stories published in ""The French Dispatch Magazine"".",https://m.media-amazon.com/images/M/MV5BNmQxZTNiODYtNzBhYy00MzVlLWJlN2UtNTc4YWZjMDIwMmEzXkEyXkFqcGdeQXVyMTkxNjUyNQ@@.jpg,Drama
