movie_id,original_title,genres,synopsis,cover_url,orig_genre
1570728,"Crazy, Stupid, Love.","['Comedy', 'Drama', 'Romance']","A middle-aged husband's life changes dramatically when his wife asks him for a divorce. He seeks to rediscover his manhood with the help of a newfound friend, Jacob, learning to pick up girls at bars.",https://m.media-amazon.com/images/M/MV5BMTg2MjkwMTM0NF5BMl5BanBnXkFtZTcwMzc4NDg2NQ@@.jpg,Drama
780504,Drive,"['Action', 'Drama']","A mysterious Hollywood action film stuntman who moonlights as a getaway driver, gets in trouble with gangsters when he tries to help his neighbor's husband rob a pawn shop while serving as his getaway driver,",https://m.media-amazon.com/images/M/MV5BZjY5ZjQyMjMtMmEwOC00Nzc2LTllYTItMmU2MzJjNTg1NjY0XkEyXkFqcGdeQXVyNjQ1MTMzMDQ@.jpg,Drama
110357,The Lion King,"['Animation', 'Adventure', 'Drama', 'Family', 'Musical']","Lion prince Simba and his father are targeted by his bitter uncle, who wants to ascend the throne himself.",https://m.media-amazon.com/images/M/MV5BYTYxNGMyZTYtMjE3MS00MzNjLWFjNmYtMDk3N2FmM2JiM2M1XkEyXkFqcGdeQXVyNjY5NDU4NzI@.jpg,Drama
115963,The Craft,"['Drama', 'Fantasy', 'Horror', 'Thriller']","A newcomer to a Catholic prep high school falls in with a trio of outcast teenage girls who practice witchcraft, and they all soon conjure up various spells and curses against those who anger them.",https://m.media-amazon.com/images/M/MV5BZTBkMWE1NGItZTgxMi00ZTE0LWIzZjAtNzQ5ZGZlZTQxN2EwXkEyXkFqcGdeQXVyMTQxNzMzNDI@.jpg,Drama
8129806,To Leslie,['Drama'],"Inspired by true events. A West Texas single mother wins the lottery and squanders it just as fast, leaving behind a world of heartbreak. Years later, with her charm running out and nowhere to go, she fights to rebuild her life and find redemption.",https://m.media-amazon.com/images/M/MV5BNmNiMGRkYmUtYjI4MC00ZDg4LTk3YjktNTczNzEzYmExMjAwXkEyXkFqcGdeQXVyMTQ4MTk0NjYx.jpg,Drama
63522,Rosemary's Baby,"['Drama', 'Horror']","A young couple trying for a baby moves into an aging, ornate apartment building on Central Park West, where they find themselves surrounded by peculiar neighbors.",https://m.media-amazon.com/images/M/MV5BMTA5NWQwMmYtZjEyYS00Nzc2LTgwZjAtNTQ4NmFmZjNkNjg4XkEyXkFqcGdeQXVyMjUzOTY1NTc@.jpg,Drama
372784,Batman Begins,"['Action', 'Crime', 'Drama']","After training with his mentor, Batman begins his fight to free crime-ridden Gotham City from corruption.",https://m.media-amazon.com/images/M/MV5BOTY4YjI2N2MtYmFlMC00ZjcyLTg3YjEtMDQyM2ZjYzQ5YWFkXkEyXkFqcGdeQXVyMTQxNzMzNDI@.jpg,Drama
96446,Willow,"['Action', 'Adventure', 'Drama', 'Fantasy', 'Romance']",A young farmer is chosen to undertake a perilous journey in order to protect a special baby from an evil queen.,https://m.media-amazon.com/images/M/MV5BZWIyMTA2M2ItOGI5MC00OTY0LWFmZTItN2NkOWQ0MGQ5NDkyL2ltYWdlXkEyXkFqcGdeQXVyMTQxNzMzNDI@.jpg,Drama
12996154,365 Days: This Day,"['Drama', 'Romance']",Laura and Massimo are back and stronger than ever. But Massimo's family ties and a mysterious man bidding for Laura's heart complicate the lovers' lives.,https://m.media-amazon.com/images/M/MV5BYjY2NzUxNjgtNjJhNy00NTA4LTlmNzItYzQ4MDdjNWYxZjkwXkEyXkFqcGdeQXVyMTEwMTY3NDI@.jpg,Drama
7984734,The Lighthouse,"['Drama', 'Fantasy', 'Horror', 'Mystery', 'Thriller']",Two lighthouse keepers try to maintain their sanity while living on a remote and mysterious New England island in the 1890s.,https://m.media-amazon.com/images/M/MV5BZmE0MGJhNmYtOWNjYi00Njc5LWE2YjEtMWMxZTVmODUwMmMxXkEyXkFqcGdeQXVyMTkxNjUyNQ@@.jpg,Drama
457430,El laberinto del fauno,"['Drama', 'Fantasy', 'War']","In the Falangist Spain of 1944, the bookish young stepdaughter of a sadistic army officer escapes into an eerie but captivating fantasy world.",https://m.media-amazon.com/images/M/MV5BYzFjMThiMGItOWRlMC00MDI4LThmOGUtYTNlZGZiYWI1YjMyXkEyXkFqcGdeQXVyMjUzOTY1NTc@.jpg,Drama
5580390,The Shape of Water,"['Drama', 'Fantasy', 'Romance']","At a top secret research facility in the 1960s, a lonely janitor forms a unique relationship with an amphibious creature that is being held in captivity.",https://m.media-amazon.com/images/M/MV5BNGNiNWQ5M2MtNGI0OC00MDA2LWI5NzEtMmZiYjVjMDEyOWYzXkEyXkFqcGdeQXVyMjM4NTM5NDY@.jpg,Drama
9602472,Sissy,"['Comedy', 'Drama', 'Horror', 'Romance', 'Thriller']","Teen best friends Cecilia and Emma, after a decade run into each other. Cecilia is invited on Emma's bachelorette weekend where she gets stuck in a remote cabin with her high school bully with a taste for revenge.",https://m.media-amazon.com/images/M/MV5BMmJmMjBjZDktY2NiMi00OTMxLTg1MjEtMDE0ZDhmMDc2MzkzXkEyXkFqcGdeQXVyMTQ4NDI1OTM5.jpg,Drama
2119532,Hacksaw Ridge,"['Biography', 'Drama', 'History', 'War']","World War II American Army Medic Desmond T. Doss, who served during the Battle of Okinawa, refuses to kill people and becomes the first man in American history to receive the Medal of Honor without firing a shot.",https://m.media-amazon.com/images/M/MV5BMjQ1NjM3MTUxNV5BMl5BanBnXkFtZTgwMDc5MTY5OTE@.jpg,Drama
6566576,Fear Street: 1994,"['Drama', 'Horror', 'Mystery']",A circle of teenage friends accidentally encounter the ancient evil responsible for a series of brutal murders that have plagued their town for over 300 years. Welcome to Shadyside.,https://m.media-amazon.com/images/M/MV5BNzQzYjIyZDQtMjBhZS00MzU3LTk0MTQtNTVmMDI3ZWY0ZWU3XkEyXkFqcGdeQXVyMTkxNjUyNQ@@.jpg,Drama
119643,Meet Joe Black,"['Drama', 'Fantasy', 'Romance']","Death, who takes the form of a young man killed in an accident, asks a media mogul to act as his guide to teach him about life on Earth and, in the process, he falls in love with the mogul's daughter.",https://m.media-amazon.com/images/M/MV5BNTc0MzRmMTgtMTk4OS00MzdkLWJjNWMtZWJmZjlkYTI0YWRiL2ltYWdlL2ltYWdlXkEyXkFqcGdeQXVyMTQxNzMzNDI@.jpg,Drama
3228774,Cruella,"['Adventure', 'Comedy', 'Crime', 'Drama']",A live-action prequel feature film following a young Cruella de Vil.,https://m.media-amazon.com/images/M/MV5BOWI5YTUxOWEtZmRiZS00ZmQxLWE2NzctYTRiODA2NzE1ZjczXkEyXkFqcGdeQXVyMDM2NDM2MQ@@.jpg,Drama
14857730,The Enforcer,"['Action', 'Crime', 'Drama', 'Thriller']",An enforcer has to sacrifice everything to save a young girl he has befriended from his femme fatale boss who is involved in cybersex trafficking.,https://m.media-amazon.com/images/M/MV5BZDQyMzU1MjctNWE0MS00MmU3LTliYjMtMjNhNjIzNThiMmNjXkEyXkFqcGdeQXVyNDExMzMxNjE@.jpg,Drama
93058,Full Metal Jacket,"['Drama', 'War']",A pragmatic U.S. Marine observes the dehumanizing effects the Vietnam War has on his fellow recruits from their brutal boot camp training to the bloody street fighting in Hue.,https://m.media-amazon.com/images/M/MV5BNzkxODk0NjEtYjc4Mi00ZDI0LTgyYjEtYzc1NDkxY2YzYTgyXkEyXkFqcGdeQXVyNzkwMjQ5NzM@.jpg,Drama
469494,There Will Be Blood,['Drama'],"A story of family, religion, hatred, oil and madness, focusing on a turn-of-the-century prospector in the early days of the business.",https://m.media-amazon.com/images/M/MV5BMjAxODQ4MDU5NV5BMl5BanBnXkFtZTcwMDU4MjU1MQ@@.jpg,Drama
2543164,Arrival,"['Drama', 'Mystery', 'Sci-Fi']",A linguist works with the military to communicate with alien lifeforms after twelve mysterious spacecraft appear around the world.,https://m.media-amazon.com/images/M/MV5BMTExMzU0ODcxNDheQTJeQWpwZ15BbWU4MDE1OTI4MzAy.jpg,Drama
4995790,The Square,"['Comedy', 'Drama']",A prestigious Stockholm museum's chief art curator finds himself in times of both professional and personal crisis as he attempts to set up a controversial new exhibit.,https://m.media-amazon.com/images/M/MV5BMmJjNzk0ODMtMzllOC00MjIwLWFhZjEtOTFjMmY3ZDU4MDRlXkEyXkFqcGdeQXVyODc0OTEyNDU@.jpg,Drama
120382,The Truman Show,"['Comedy', 'Drama']",An insurance salesman discovers his whole life is actually a reality TV show.,https://m.media-amazon.com/images/M/MV5BMDIzODcyY2EtMmY2MC00ZWVlLTgwMzAtMjQwOWUyNmJjNTYyXkEyXkFqcGdeQXVyNDk3NzU2MTQ@.jpg,Drama
112641,Casino,"['Crime', 'Drama']","A tale of greed, deception, money, power, and murder occur between two best friends: a mafia enforcer and a casino executive compete against each other over a gambling empire, and over a fast-living and fast-loving socialite.",https://m.media-amazon.com/images/M/MV5BMTcxOWYzNDYtYmM4YS00N2NkLTk0NTAtNjg1ODgwZjAxYzI3XkEyXkFqcGdeQXVyNTA4NzY1MzY@.jpg,Drama
314331,Love Actually,"['Comedy', 'Drama', 'Romance']","Follows the lives of eight very different couples in dealing with their love lives in various loosely interrelated tales all set during a frantic month before Christmas in London, England.",https://m.media-amazon.com/images/M/MV5BMTY4NjQ5NDc0Nl5BMl5BanBnXkFtZTYwNjk5NDM3.jpg,Drama
409459,Watchmen,"['Action', 'Drama', 'Mystery', 'Sci-Fi']","In 1985 where former superheroes exist, the murder of a colleague sends active vigilante Rorschach into his own sprawling investigation, uncovering something that could completely change the course of history as we know it.",https://m.media-amazon.com/images/M/MV5BY2IzNGNiODgtOWYzOS00OTI0LTgxZTUtOTA5OTQ5YmI3NGUzXkEyXkFqcGdeQXVyNjU0OTQ0OTY@.jpg,Drama
120780,Out of Sight,"['Comedy', 'Crime', 'Drama', 'Romance', 'Thriller']","A career bank robber breaks out of jail, and shares a moment of mutual attraction with a U.S. Marshal he has kidnapped.",https://m.media-amazon.com/images/M/MV5BYWExMWM5ZjYtMWZmZC00YjFjLTkzMjEtNzEyNDBmMGJhYWJiXkEyXkFqcGdeQXVyMjUxMTY3ODM@.jpg,Drama
11897478,The Stranger,"['Crime', 'Drama', 'Thriller']","Two men who meet on a plane and strike up a conversation that turns into friendship. For Henry Teague, worn down by a lifetime of physical labour and crime, this is a dream come true.",https://m.media-amazon.com/images/M/MV5BYzhmNWMyYjQtNTVlMC00MGUwLWFmYjEtM2NkNWY0ODQ2YmFiXkEyXkFqcGdeQXVyMTEyMjM2NDc2.jpg,Drama
8503618,Hamilton,"['Biography', 'Drama', 'History', 'Musical']","The real life of one of America's foremost founding fathers and first Secretary of the Treasury, Alexander Hamilton. Captured live on Broadway from the Richard Rodgers Theater with the original Broadway cast.",https://m.media-amazon.com/images/M/MV5BNjViNWRjYWEtZTI0NC00N2E3LTk0NGQtMjY4NTM3OGNkZjY0XkEyXkFqcGdeQXVyMjUxMTY3ODM@.jpg,Drama
1488589,Pinocchio,"['Animation', 'Drama', 'Family', 'Fantasy', 'Musical']",A darker version of the classic children's fairy tale of a wooden puppet that transforms into a real living boy.,https://m.media-amazon.com/images/M/MV5BNjBhZjNkNDItODcxMS00ZGNmLTk3ODUtOGU1NWI3N2Q3YmM1XkEyXkFqcGdeQXVyMDM2NDM2MQ@@.jpg,Drama
14298328,Look Both Ways,"['Comedy', 'Drama', 'Romance']","On the eve of her college graduation, Natalie's life diverges into parallel realities: one in which she becomes pregnant and remains in her hometown to raise her child and another in which she moves to LA to pursue her dream career.",https://m.media-amazon.com/images/M/MV5BYmU5ZTU3MWUtMmExZi00YjIxLWIyOWUtZTliNjFjMTEzNDEzXkEyXkFqcGdeQXVyMTEzMTI1Mjk3.jpg,Drama
119558,Lolita,"['Drama', 'Romance']","An English professor falls for a minor, and has to face the consequences of his actions.",https://m.media-amazon.com/images/M/MV5BOGNkZDU0YjktN2Q5Zi00MmY0LWI3Y2YtNmQzOGQxY2UzNGM3XkEyXkFqcGdeQXVyMTQxNzMzNDI@.jpg,Drama
5109784,Mother!,"['Drama', 'Horror', 'Mystery']","A couple's relationship is tested when uninvited guests arrive at their home, disrupting their tranquil existence.",https://m.media-amazon.com/images/M/MV5BMzc5ODExODE0MV5BMl5BanBnXkFtZTgwNDkzNDUxMzI@.jpg,Drama
5085522,Hostile,"['Drama', 'Horror', 'Romance', 'Sci-Fi']","Juliette, a lone survivor of an apocalyptic era, fights to survive against hunger, thirst, a broken leg and strange, disturbing creatures that only come out at nighttime.",https://m.media-amazon.com/images/M/MV5BZWYxOTM0YzMtNjAyZC00NTRmLWI3MmMtNmZiZTM4MzFlOTZhXkEyXkFqcGdeQXVyMTk4MDMyOTM@.jpg,Drama
15301048,"Argentina, 1985","['Biography', 'Crime', 'Drama', 'History']",A team of lawyers takes on the heads of Argentina's bloody military dictatorship during the 1980s in a battle against odds and a race against time.,https://m.media-amazon.com/images/M/MV5BMjhiYzUwZTYtYzU2MC00N2UwLTkwNmMtMGI1MTZjYzljNDZjXkEyXkFqcGdeQXVyNjk1Njg5NTA@.jpg,Drama
317248,Cidade de Deus,"['Crime', 'Drama']","In the slums of Rio, two kids' paths diverge as one struggles to become a photographer and the other a kingpin.",https://m.media-amazon.com/images/M/MV5BOTMwYjc5ZmItYTFjZC00ZGQ3LTlkNTMtMjZiNTZlMWQzNzI5XkEyXkFqcGdeQXVyNzkwMjQ5NzM@.jpg,Drama
7984766,The King,"['Biography', 'Drama', 'History', 'Romance', 'War']","Hal, wayward prince and heir to the English throne, is crowned King Henry V after his tyrannical father dies. Now the young king must navigate palace politics, the war his father left behind, and the emotional strings of his past life.",https://m.media-amazon.com/images/M/MV5BMWZkNzNlMzMtMjM5ZS00MWYzLWFmMmUtMjE1ODM3NjBlODA5XkEyXkFqcGdeQXVyMTMxODk2OTU@.jpg,Drama
5013056,Dunkirk,"['Action', 'Drama', 'History', 'Thriller', 'War']","Allied soldiers from Belgium, the British Commonwealth and Empire, and France are surrounded by the German Army and evacuated during a fierce battle in World War II.",https://m.media-amazon.com/images/M/MV5BN2YyZjQ0NTEtNzU5MS00NGZkLTg0MTEtYzJmMWY3MWRhZjM2XkEyXkFqcGdeQXVyMDA4NzMyOA@@.jpg,Drama
87843,Once Upon a Time in America,"['Crime', 'Drama']","A former Prohibition-era Jewish gangster returns to the Lower East Side of Manhattan 35 years later, where he must once again confront the ghosts and regrets of his old life.",https://m.media-amazon.com/images/M/MV5BMGFkNWI4MTMtNGQ0OC00MWVmLTk3MTktOGYxN2Y2YWVkZWE2XkEyXkFqcGdeQXVyNjU0OTQ0OTY@.jpg,Drama
3659388,The Martian,"['Adventure', 'Drama', 'Sci-Fi']","An astronaut becomes stranded on Mars after his team assume him dead, and must rely on his ingenuity to find a way to signal to Earth that he is alive and can survive until a potential rescue.",https://m.media-amazon.com/images/M/MV5BMTc2MTQ3MDA1Nl5BMl5BanBnXkFtZTgwODA3OTI4NjE@.jpg,Drama
470752,Ex Machina,"['Drama', 'Sci-Fi', 'Thriller']",A young programmer is selected to participate in a ground-breaking experiment in synthetic intelligence by evaluating the human qualities of a highly advanced humanoid A.I.,https://m.media-amazon.com/images/M/MV5BMTUxNzc0OTIxMV5BMl5BanBnXkFtZTgwNDI3NzU2NDE@.jpg,Drama
7557108,Saint Maud,"['Drama', 'Horror', 'Mystery', 'Thriller']",A pious nurse becomes dangerously obsessed with saving the soul of her dying patient.,https://m.media-amazon.com/images/M/MV5BYzE3ZDg0OTktYjlhNC00ZmQ0LTk0YjktMDE1ZWE2YjIwMjk4XkEyXkFqcGdeQXVyMDA4NzMyOA@@.jpg,Drama
264464,Catch Me If You Can,"['Biography', 'Crime', 'Drama']","Barely 21 yet, Frank is a skilled forger who has passed as a doctor, lawyer and pilot. FBI agent Carl becomes obsessed with tracking down the con man, who only revels in the pursuit.",https://m.media-amazon.com/images/M/MV5BMTY5MzYzNjc5NV5BMl5BanBnXkFtZTYwNTUyNTc2.jpg,Drama
11703710,Downton Abbey: A New Era,"['Drama', 'Romance']",The Crawley family goes on a grand journey to the South of France to uncover the mystery of the dowager countess's newly inherited villa.,https://m.media-amazon.com/images/M/MV5BZDdjZjM1YWItNWRmOS00OTEzLWJmYjAtOGQzNTAyNmEwNDhjXkEyXkFqcGdeQXVyMTkxNjUyNQ@@.jpg,Drama
434409,V for Vendetta,"['Action', 'Drama', 'Sci-Fi', 'Thriller']","In a future British dystopian society, a shadowy freedom fighter, known only by the alias of ""V"", plots to overthrow the tyrannical government - with the help of a young woman.",https://m.media-amazon.com/images/M/MV5BOTI5ODc3NzExNV5BMl5BanBnXkFtZTcwNzYxNzQzMw@@.jpg,Drama
5027774,"Three Billboards Outside Ebbing, Missouri","['Comedy', 'Crime', 'Drama']",A mother personally challenges the local authorities to solve her daughter's murder when they fail to catch the culprit.,https://m.media-amazon.com/images/M/MV5BMjI0ODcxNzM1N15BMl5BanBnXkFtZTgwMzIwMTEwNDI@.jpg,Drama
117913,A Time to Kill,"['Crime', 'Drama', 'Thriller']","In Clanton, Mississippi, a fearless young lawyer and his assistant defend a black man accused of murdering two white men who raped his ten-year-old daughter, inciting violent retribution and revenge from the Ku Klux Klan.",https://m.media-amazon.com/images/M/MV5BOWExZTg4ZWYtOTQxMi00YWZkLTkxYzgtOTg1MTUxNzNiNDcxL2ltYWdlL2ltYWdlXkEyXkFqcGdeQXVyMTQxNzMzNDI@.jpg,Drama
4028464,De uskyldige,"['Drama', 'Fantasy', 'Horror', 'Mystery', 'Thriller']","During the bright Nordic summer, a group of children reveal their dark and mysterious powers when the adults aren't looking. In this original and gripping supernatural thriller, playtime takes a dangerous turn.",https://m.media-amazon.com/images/M/MV5BNDgwNGFmMDMtNGQzMC00Mjc2LWFhNzItYWIxMGJlM2Q2MzZlXkEyXkFqcGdeQXVyODA0MjgyNzM@.jpg,Drama
11127680,Boiling Point,"['Drama', 'Thriller']",Enter the relentless pressure of a restaurant kitchen as a head chef wrangles his team on the busiest day of the year.,https://m.media-amazon.com/images/M/MV5BNzRkOTQ1NWYtY2QxMi00MWQ2LTg5Y2ItNzk5NTBhNDBhNGU1XkEyXkFqcGdeQXVyNDgyMjg4Ng@@.jpg,Drama
5606664,Doctor Sleep,"['Drama', 'Fantasy', 'Horror', 'Thriller']","Years following the events of The Shining (1980), a now-adult Dan Torrance must protect a young girl with similar powers from a cult known as The True Knot, who prey on children with powers to remain immortal.",https://m.media-amazon.com/images/M/MV5BYmY3NGJlYTItYmQ4OS00ZTEwLWIzODItMjMzNWU2MDE0NjZhXkEyXkFqcGdeQXVyMzQzMDA3MTI@.jpg,Drama
10399608,Cerdita,"['Drama', 'Horror', 'Thriller']",An overweight teen is bullied by a clique of cool girls poolside while holidaying in her village. The long walk home will change the rest of her life.,https://m.media-amazon.com/images/M/MV5BZWM0NTM1NjgtNDk5ZS00ZjM5LWIwODItZTUzNmEwM2I0ZjgyXkEyXkFqcGdeQXVyMTA0MjU0Ng@@.jpg,Drama
167261,The Lord of the Rings: The Two Towers,"['Action', 'Adventure', 'Drama', 'Fantasy']","While Frodo and Sam edge closer to Mordor with the help of the shifty Gollum, the divided fellowship makes a stand against Sauron's new ally, Saruman, and his hordes of Isengard.",https://m.media-amazon.com/images/M/MV5BZGMxZTdjZmYtMmE2Ni00ZTdkLWI5NTgtNjlmMjBiNzU2MmI5XkEyXkFqcGdeQXVyNjU0OTQ0OTY@.jpg,Drama
14549466,Crimes of the Future,"['Drama', 'Horror', 'Sci-Fi']","Humans adapt to a synthetic environment, with new transformations and mutations. With his partner Caprice, Saul Tenser, celebrity performance artist, publicly showcases the metamorphosis of his organs in avant-garde performances.",https://m.media-amazon.com/images/M/MV5BZDdjODNkMmYtYjMwNS00NTQzLThlYjUtODY2ZjdjNTNlY2JiXkEyXkFqcGdeQXVyMTkxNjUyNQ@@.jpg,Drama
20850406,Sita Ramam,"['Action', 'Drama', 'Mystery', 'Romance']","An orphan soldier, Lieutenant Ram's life changes, after he gets a letter from a girl named Sita. He meets her and love blossoms between them. When he comes back to his camp in Kashmir,After he gets caught in jail, he sends a letter to Sita which won't reach her.",https://m.media-amazon.com/images/M/MV5BN2RjZDJhYzUtOTQ5Yy00OWM3LWE5OTctM2Y0YWVmNzAzODllXkEyXkFqcGdeQXVyMTA3MDk2NDg2.jpg,Drama
114369,Se7en,"['Crime', 'Drama', 'Mystery', 'Thriller']","Two detectives, a rookie and a veteran, hunt a serial killer who uses the seven deadly sins as his motives.",https://m.media-amazon.com/images/M/MV5BOTUwODM5MTctZjczMi00OTk4LTg3NWUtNmVhMTAzNTNjYjcyXkEyXkFqcGdeQXVyNjU0OTQ0OTY@.jpg,Drama
99487,Edward Scissorhands,"['Drama', 'Fantasy', 'Romance']","An artificial man, who was incompletely constructed and has scissors for hands, leads a solitary life. Then one day, a suburban lady meets him and introduces him to her world.",https://m.media-amazon.com/images/M/MV5BMWY2MGRkNjgtZDczNi00YWJjLTkwNmUtMTY0NTE5ZDhkZjgwXkEyXkFqcGdeQXVyMjUzOTY1NTc@.jpg,Drama
19770238,Aftersun,['Drama'],Sophie reflects on the shared joy and private melancholy of a holiday she took with her father twenty years earlier. Memories real and imagined fill the gaps between as she tries to reconcile the father she knew with the man she didn't.,https://m.media-amazon.com/images/M/MV5BMTM3OTU0ZGUtNzYwYy00ODU3LWI3YjgtOWZlODliMmRiMWEzXkEyXkFqcGdeQXVyMTAyMjQ3NzQ1.jpg,Drama
7286456,Joker,"['Crime', 'Drama', 'Thriller']",A mentally troubled stand-up comedian embarks on a downward spiral that leads to the creation of an iconic villain.,https://m.media-amazon.com/images/M/MV5BNGVjNWI4ZGUtNzE0MS00YTJmLWE0ZDctN2ZiYTk2YmI3NTYyXkEyXkFqcGdeQXVyMTkxNjUyNQ@@.jpg,Drama
15255876,Emily the Criminal,"['Crime', 'Drama', 'Thriller']","Down on her luck and saddled with debt, Emily gets involved in a credit card scam that pulls her into the criminal underworld of Los Angeles, ultimately leading to deadly consequences.",https://m.media-amazon.com/images/M/MV5BOGI4ODQwYjUtZTA4Mi00YTljLWE4MzItM2M4OGJiNTFkZjIyXkEyXkFqcGdeQXVyMTM1MTE1NDMx.jpg,Drama
15398776,Oppenheimer,"['Biography', 'Drama', 'History']",The story of American scientist J. Robert Oppenheimer and his role in the development of the atomic bomb.,https://m.media-amazon.com/images/M/MV5BMDI5ZTVmMmMtZjg1Ny00NzNkLWFkMDctZDlmMzQ4MDcyODZlXkEyXkFqcGdeQXVyMzM1NDY1MDE@.jpg,Drama
118749,Boogie Nights,['Drama'],"Back when sex was safe, pleasure was a business and business was booming, an idealistic porn producer aspires to elevate his craft to an art when he discovers a hot young talent.",https://m.media-amazon.com/images/M/MV5BY2E2YWYxY2QtZmJmZi00MjJlLWFiYWItZTk5Y2IyMWQ1ZThhXkEyXkFqcGdeQXVyMTMxODk2OTU@.jpg,Drama
14208870,The Fabelmans,['Drama'],"Growing up in post-World War II era Arizona, a young man named Sammy Fabelman discovers a shattering family secret and explores how the power of films can help him see the truth.",https://m.media-amazon.com/images/M/MV5BZGM1MzczNmQtMjBmYS00NTRhLWI0MzctNTFkZDc4OGUyODdjXkEyXkFqcGdeQXVyMjMxOTE0ODA@.jpg,Drama
9288822,The Wonder,"['Drama', 'Mystery', 'Thriller']","A tale of two strangers who transform each other's lives, a psychological thriller, and a story of love pitted against evil.",https://m.media-amazon.com/images/M/MV5BNDBmNzIwY2QtMjZhOC00YzlhLWIwNjMtZDdkZjY3OWUzZDI4XkEyXkFqcGdeQXVyMTAyMjQ3NzQ1.jpg,Drama
12262116,Thirteen Lives,"['Action', 'Adventure', 'Biography', 'Drama', 'Thriller']",A rescue mission is assembled in Thailand where a group of young boys and their soccer coach are trapped in a system of underground caves that are flooding.,https://m.media-amazon.com/images/M/MV5BNzI4YzkyMTYtYmQ1MC00NjYwLThkMDgtY2E1Njg1MTAzZWJhXkEyXkFqcGdeQXVyMDM2NDM2MQ@@.jpg,Drama
3569230,Legend,"['Biography', 'Crime', 'Drama', 'Thriller']",Identical twin gangsters Ronald and Reginald Kray terrorize London during the 1960s.,https://m.media-amazon.com/images/M/MV5BMjE0MjkyODQ3NF5BMl5BanBnXkFtZTgwNDM1OTk1NjE@.jpg,Drama
172495,Gladiator,"['Action', 'Adventure', 'Drama']",A former Roman General sets out to exact vengeance against the corrupt emperor who murdered his family and sent him into slavery.,https://m.media-amazon.com/images/M/MV5BMDliMmNhNDEtODUyOS00MjNlLTgxODEtN2U3NzIxMGVkZTA1L2ltYWdlXkEyXkFqcGdeQXVyNjU0OTQ0OTY@.jpg,Drama
117665,Sleepers,"['Crime', 'Drama', 'Thriller']","After a prank goes disastrously wrong, a group of boys are sent to a detention center where they are brutalized. Thirteen years later, an unexpected random encounter with a former guard gives them a chance for revenge.",https://m.media-amazon.com/images/M/MV5BMzk1MmI4NzAtOGRiNS00YjY1LTllNmEtZDhiZDM4MjU2NTMxXkEyXkFqcGdeQXVyNjc3MjQzNTI@.jpg,Drama
10886166,365 dni,"['Drama', 'Romance']","Massimo is a member of the Sicilian Mafia family and Laura is a sales director. She does not expect that on a trip to Sicily trying to save her relationship, Massimo will kidnap her and give her 365 days to fall in love with him.",https://m.media-amazon.com/images/M/MV5BMDdhYzNkOWQtYWNlNi00NDdjLWJlZDMtMjJjZDYyNjAxM2U1XkEyXkFqcGdeQXVyMTQyMTMwOTk0.jpg,Drama
13352968,"Good Luck to You, Leo Grande","['Comedy', 'Drama']","Nancy Stokes, a retired school teacher, is yearning for some adventure, and some sex. And she has a plan, which involves hiring a young sex worker named Leo Grande.",https://m.media-amazon.com/images/M/MV5BNjE1ZGM4NTQtZGJiZS00ZjczLWIzZjgtNmZlNjZlZTEwYjlkXkEyXkFqcGdeQXVyODk4OTc3MTY@.jpg,Drama
11214590,House of Gucci,"['Biography', 'Crime', 'Drama']","When Patrizia Reggiani, an outsider from humble beginnings, marries into the Gucci family, her unbridled ambition begins to unravel their legacy and triggers a reckless spiral of betrayal, decadence, revenge, and ultimately...murder.",https://m.media-amazon.com/images/M/MV5BYzdlMTMyZWQtZWNmMC00MTJiLWIyMWMtM2ZlZDdlYzZhNTc0XkEyXkFqcGdeQXVyMTMzNDE5NDM2.jpg,Drama
955308,Robin Hood,"['Action', 'Adventure', 'Drama', 'History']","In twelfth-century England, Robin Longstride and his band of marauders confront corruption in a local village and lead an uprising against the crown that will forever alter the balance of world power.",https://m.media-amazon.com/images/M/MV5BMTM5NzcwMzEwOF5BMl5BanBnXkFtZTcwNjg5MTgwMw@@.jpg,Drama
10954652,Old,"['Drama', 'Horror', 'Mystery', 'Thriller']","A vacationing family discovers that the secluded beach where they're relaxing for a few hours is somehow causing them to age rapidly, reducing their entire lives into a single day.",https://m.media-amazon.com/images/M/MV5BMjJjZGRhM2YtNTU4NC00OWMwLThhYWUtMWUxNDNhMDZlOTNmXkEyXkFqcGdeQXVyODE5NzE3OTE@.jpg,Drama
3281548,Little Women,"['Drama', 'Romance']","Jo March reflects back and forth on her life, telling the beloved story of the March sisters - four young women, each determined to live life on her own terms.",https://m.media-amazon.com/images/M/MV5BY2QzYTQyYzItMzAwYi00YjZlLThjNTUtNzMyMDdkYzJiNWM4XkEyXkFqcGdeQXVyMTkxNjUyNQ@@.jpg,Drama
7846844,Enola Holmes,"['Action', 'Adventure', 'Crime', 'Drama', 'Mystery']","When Enola Holmes-Sherlock's teen sister-discovers her mother is missing, she sets off to find her, becoming a super-sleuth in her own right as she outwits her famous brother and unravels a dangerous conspiracy around a mysterious young Lord.",https://m.media-amazon.com/images/M/MV5BZjNkNzk0ZjEtM2M1ZC00MmMxLTlmOWEtNWRlZTc1ZTUyNzY4XkEyXkFqcGdeQXVyMTEyMjM2NDc2.jpg,Drama
